{
  "$schema": "https://json-schema.org/draft/2020-12/schema",
  "$id": "https://qiongli.dev/schemas/tools/qiongli_literature_search.full.output.v2.json",
  "title": "qiongli_literature_search full structured output",
  "type": "object",
  "required": [
    "status",
    "summary",
    "provenance",
    "data"
  ],
  "properties": {
    "status": {
      "type": "string"
    },
    "summary": {
      "type": "string"
    },
    "provenance": {
      "type": "array",
      "items": {
        "type": "string"
      }
    },
    "data": {
      "type": "object",
      "additionalProperties": true
    }
  },
  "additionalProperties": false
}
